{
  "$schema": "./evidence-index.schema.json",
  "schema_version": "1.0.0",
  "generated_at": "2026-08-07",
  "root_owner": "dofaromg",
  "canonical_name": "mrliouai",
  "origin_signature": "MrLiouWord",
  "completeness_status": "in-progress",
  "evidence": [
    {
      "id": "E001",
      "repo": "dofaromg/flow-tasks",
      "path": "MRL_Mother/00_rootlaw/MRL_ROOT_AUTHORITY_v1.md",
      "commit_sha": "06dc98299897c09c63b77f23968e681e09e51362",
      "permalink": "https://github.com/dofaromg/flow-tasks/blob/06dc98299897c09c63b77f23968e681e09e51362/MRL_Mother/00_rootlaw/MRL_ROOT_AUTHORITY_v1.md",
      "category": "Root Authority Declaration",
      "summary": "root_authority: Mr.liou; Mr.liou/MrLiouWord is MRL origin, creator, and final naming/authorization/commercial decision authority; automation may only execute rules, not authorize in place of Root.",
      "claims_supported": [
        "root_identity",
        "non_replaceability",
        "ai_cannot_self_authorize"
      ],
      "evidence_strength": "direct",
      "canonical": true,
      "conflict_status": "none"
    },
    {
      "id": "E002",
      "repo": "dofaromg/----2",
      "path": "docs/SOVEREIGNTY.md",
      "commit_sha": "47484ba7d7a9672053e07fb4077dd9a55aaf14ed",
      "permalink": "https://github.com/dofaromg/----2/blob/47484ba7d7a9672053e07fb4077dd9a55aaf14ed/docs/SOVEREIGNTY.md",
      "category": "Sovereignty Declaration",
      "summary": "Root Owner: Mr.liou / GitHub dofaromg; Root retains all rights of definition, modification, naming, authorization, revocation, merge, rejection, deployment, and final interpretation; AI tools and external platforms do not gain Root status by hosting or executing.",
      "claims_supported": [
        "root_identity",
        "global_sovereignty",
        "ai_cannot_elevate"
      ],
      "evidence_strength": "direct",
      "canonical": true,
      "conflict_status": "none"
    },
    {
      "id": "E003",
      "repo": "dofaromg/----2",
      "path": "README.md",
      "commit_sha": "47484ba7d7a9672053e07fb4077dd9a55aaf14ed",
      "permalink": "https://github.com/dofaromg/----2/blob/47484ba7d7a9672053e07fb4077dd9a55aaf14ed/README.md",
      "category": "Repository Overview",
      "summary": "Core repository README establishing mRLiouAI governance baseline entry point.",
      "claims_supported": [
        "repo_ownership",
        "governance_baseline"
      ],
      "evidence_strength": "corroborating",
      "canonical": true,
      "conflict_status": "none"
    },
    {
      "id": "E004",
      "repo": "dofaromg/----2",
      "path": "docs/NAMING.md",
      "commit_sha": "47484ba7d7a9672053e07fb4077dd9a55aaf14ed",
      "permalink": "https://github.com/dofaromg/----2/blob/47484ba7d7a9672053e07fb4077dd9a55aaf14ed/docs/NAMING.md",
      "category": "Naming Authority",
      "summary": "Establishes mRLiouAI as the sole external brand name; historical spellings listed as aliases with explicit migration rules.",
      "claims_supported": [
        "canonical_naming",
        "naming_authority"
      ],
      "evidence_strength": "direct",
      "canonical": true,
      "conflict_status": "historical_spellings_registered_as_alias"
    },
    {
      "id": "E005",
      "repo": "dofaromg/----2",
      "path": "docs/SYSTEM_POSITIONING.md",
      "commit_sha": "47484ba7d7a9672053e07fb4077dd9a55aaf14ed",
      "permalink": "https://github.com/dofaromg/----2/blob/47484ba7d7a9672053e07fb4077dd9a55aaf14ed/docs/SYSTEM_POSITIONING.md",
      "category": "System Positioning",
      "summary": "Defines mRLiouAI positioning in market and tech stack, vendor hierarchy, and public display restrictions.",
      "claims_supported": [
        "public_internal_boundary",
        "vendor_cannot_elevate"
      ],
      "evidence_strength": "direct",
      "canonical": true,
      "conflict_status": "none"
    },
    {
      "id": "E006",
      "repo": "dofaromg/flow-tasks-01",
      "path": "AUTHORITY_ROOT.md",
      "commit_sha": "33422c2e666632b198e51c762b9fb2b2e4ef04bc",
      "permalink": "https://github.com/dofaromg/flow-tasks-01/blob/33422c2e666632b198e51c762b9fb2b2e4ef04bc/AUTHORITY_ROOT.md",
      "category": "Authority Declaration",
      "summary": "root_owner: dofaromg; dofaromg is sole Root of this repository; Root declaration may not be split or removed; explicitly scoped to this repo — does not claim authority over external systems.",
      "claims_supported": [
        "root_identity",
        "repo_scope_limitation"
      ],
      "evidence_strength": "direct",
      "canonical": true,
      "conflict_status": "repo_scope_vs_global_claim_see_C003"
    },
    {
      "id": "E007",
      "repo": "dofaromg/flow-tasks-01",
      "path": "docs/STATUS_AUTHORITY.md",
      "commit_sha": "33422c2e666632b198e51c762b9fb2b2e4ef04bc",
      "permalink": "https://github.com/dofaromg/flow-tasks-01/blob/33422c2e666632b198e51c762b9fb2b2e4ef04bc/docs/STATUS_AUTHORITY.md",
      "category": "Status Authority Record",
      "summary": "Governance status and authorization record confirming Root approval chain is valid.",
      "claims_supported": [
        "governance_status",
        "approval_chain"
      ],
      "evidence_strength": "corroborating",
      "canonical": true,
      "conflict_status": "none"
    },
    {
      "id": "E008",
      "repo": "dofaromg/flow-tasks-01",
      "path": "governance/INTERNAL_GATE.yaml",
      "commit_sha": "33422c2e666632b198e51c762b9fb2b2e4ef04bc",
      "permalink": "https://github.com/dofaromg/flow-tasks-01/blob/33422c2e666632b198e51c762b9fb2b2e4ef04bc/governance/INTERNAL_GATE.yaml",
      "category": "Access Gate",
      "summary": "Governance file changes require dofaromg approval; Gate may not be bypassed, delegated, or overridden without Root consent.",
      "claims_supported": [
        "technical_gate",
        "non_bypassable_restriction"
      ],
      "evidence_strength": "direct_executable",
      "canonical": true,
      "conflict_status": "relationship_with_sole_root_final_decision_see_C006"
    },
    {
      "id": "E009",
      "repo": "dofaromg/flow-tasks-01",
      "path": "governance/ACCEPTANCE_GATE.yaml",
      "commit_sha": "33422c2e666632b198e51c762b9fb2b2e4ef04bc",
      "permalink": "https://github.com/dofaromg/flow-tasks-01/blob/33422c2e666632b198e51c762b9fb2b2e4ef04bc/governance/ACCEPTANCE_GATE.yaml",
      "category": "Acceptance Gate",
      "summary": "Acceptance gate defining acceptable change conditions and rejection criteria.",
      "claims_supported": [
        "technical_gate",
        "acceptance_criteria"
      ],
      "evidence_strength": "direct_executable",
      "canonical": true,
      "conflict_status": "none"
    },
    {
      "id": "E010",
      "repo": "dofaromg/flow-tasks-01",
      "path": "evidence/EVIDENCE_MANIFEST.json",
      "commit_sha": "33422c2e666632b198e51c762b9fb2b2e4ef04bc",
      "permalink": "https://github.com/dofaromg/flow-tasks-01/blob/33422c2e666632b198e51c762b9fb2b2e4ef04bc/evidence/EVIDENCE_MANIFEST.json",
      "category": "Evidence Manifest",
      "summary": "Machine-readable evidence manifest recording integrity verification hashes and summaries of governance assets.",
      "claims_supported": [
        "asset_integrity",
        "verifiability"
      ],
      "evidence_strength": "direct_executable",
      "canonical": true,
      "conflict_status": "none"
    },
    {
      "id": "E011",
      "repo": "dofaromg/MRL_AI_SYSTEM",
      "path": "docs/mrliouai_產品正名與材料附錄_v1.md",
      "commit_sha": "52c5bd617df3156cc4483a53231c1dbdf50cd782",
      "permalink": "https://github.com/dofaromg/MRL_AI_SYSTEM/blob/52c5bd617df3156cc4483a53231c1dbdf50cd782/docs/mrliouai_%E7%94%A2%E5%93%81%E6%AD%A3%E5%90%8D%E8%88%87%E6%9D%90%E6%96%99%E9%99%84%E9%8C%84_v1.md",
      "category": "Product Naming & Materials Annex",
      "summary": "Establishes product naming hierarchy, parent layer, model supply side, and external Adapter structure; mrliouai is the canonical external product name; other internal spellings retained unchanged.",
      "claims_supported": [
        "product_naming",
        "layer_hierarchy",
        "historical_migration"
      ],
      "evidence_strength": "direct",
      "canonical": true,
      "conflict_status": "mrliouai_is_canonical_external_name_internal_names_retained"
    },
    {
      "id": "E012",
      "repo": "dofaromg/----2",
      "path": "ingest/2026-07-25/definition/mrliouai_CoverageMap_v1_0_0.md",
      "commit_sha": "47484ba7d7a9672053e07fb4077dd9a55aaf14ed",
      "permalink": "https://github.com/dofaromg/----2/blob/47484ba7d7a9672053e07fb4077dd9a55aaf14ed/ingest/2026-07-25/definition/mrliouai_CoverageMap_v1_0_0.md",
      "category": "Coverage Map",
      "summary": "Records deduplication, distillation, refactoring, provenance tracking, and acceptance results of 'do not elevate external names' rule.",
      "claims_supported": [
        "provenance_tracking",
        "external_names_not_elevatable"
      ],
      "evidence_strength": "direct",
      "canonical": true,
      "conflict_status": "none"
    },
    {
      "id": "E013",
      "repo": "dofaromg/flow-tasks",
      "path": "scripts/validate_mrl_governance.py",
      "commit_sha": "06dc98299897c09c63b77f23968e681e09e51362",
      "permalink": "https://github.com/dofaromg/flow-tasks/blob/06dc98299897c09c63b77f23968e681e09e51362/scripts/validate_mrl_governance.py",
      "category": "Validation Script",
      "summary": "Early governance validation script verifying Root authorization, naming, and governance rules.",
      "claims_supported": [
        "technical_validation",
        "governance_enforceability"
      ],
      "evidence_strength": "corroborating",
      "canonical": true,
      "conflict_status": "none"
    },
    {
      "id": "E014",
      "repo": "dofaromg/flow-tasks",
      "path": "MRL_Mother/06_trace/MRL_GOVERNANCE_PACKAGE_SHA256SUMS_v1.txt",